Symbol,Name,Last Sale,Net Change,% Change,Market Cap,Country,IPO Year,Volume,Sector,Industry
RCMT,RCM Technologies Inc. Common Stock,$1.65,-0.03,-1.786%,18915031.00,United States,,31211,Technology,Professional Services
RCON,Recon Technology Ltd. Ordinary Shares,$1.33,-0.05,-3.623%,9579767.00,China,2009,738789,Energy,Oilfield Services/Equipment
RDCM,Radcom Ltd. Ordinary Shares,$10.70,0.19,1.808%,149197119.00,Israel,1997,23363,Technology,Computer peripheral equipment
RDFN,Redfin Corporation Common Stock,$59.70,1.05,1.79%,6109937457.00,United States,2017,1451290,Finance,Real Estate
RDHL,Redhill Biopharma Ltd. American Depositary Shares,$8.08,-0.26,-3.118%,304574832.00,Israel,,166934,Health Care,Major Pharmaceuticals
RDI,Reading International Inc Class A Common Stock,$4.35,0.15,3.571%,94609007.00,United States,,248239,Consumer Services,Movies/Entertainment
RDIB,Reading International Inc Class B Common Stock,$23.00,-2.00,-8.00%,500231531.00,United States,,2117,Consumer Services,Movies/Entertainment
RDNT,RadNet Inc. Common Stock,$18.73,-0.47,-2.448%,967144134.00,United States,,117801,Health Care,Medical Specialities
RDUS,Radius Health Inc. Common Stock,$14.17,0.12,0.854%,659576474.00,United States,2014,249447,Health Care,Major Pharmaceuticals
RDVT,Red Violet Inc. Common Stock ,$27.72,0.26,0.947%,336798970.00,United States,,21552,Technology,Computer Software: Prepackaged Software
RDWR,Radware Ltd. Ordinary Shares,$25.43,-0.05,-0.196%,1173853327.00,Israel,1999,124072,Miscellaneous,Business Services
REAL,The RealReal Inc. Common Stock,$15.69,-0.37,-2.304%,1389779516.00,United States,2019,1442657,Consumer Services,Other Specialty Stores
REDU,RISE Education Cayman Ltd American Depositary Shares,$6.33,-0.13,-2.012%,356873759.00,China,2017,9381,Consumer Services,Other Consumer Services
REED,Reeds Inc. Common Stock,$0.6431,-0.0048,-0.741%,52552569.00,United States,,425567,Consumer Non-Durables,Beverages (Production/Distribution)
REFR,Research Frontiers Incorporated Common Stock,$2.75,0.03,1.103%,86833412.00,United States,,348154,Miscellaneous,Multi-Sector Companies
REG,Regency Centers Corporation Common Stock,$47.08,-0.53,-1.113%,7988540615.00,United States,1993,806552,Consumer Services,Real Estate Investment Trusts
REGI,Renewable Energy Group Inc. Common Stock,$62.15,4.30,7.433%,2444528486.00,United States,2012,1248270,Basic Industries,Major Chemicals
REGN,Regeneron Pharmaceuticals Inc. Common Stock,$479.77,0.79,0.165%,51194464279.00,United States,1991,1013415,Health Care,Major Pharmaceuticals
REKR,Rekor Systems Inc. Common Stock,$5.55,0.14,2.588%,183007126.00,United States,,386786,Capital Goods,Telecommunications Equipment
RELL,Richardson Electronics Ltd. Common Stock,$4.57,-0.10,-2.141%,60358979.00,United States,1983,39724,Technology,Electronic Components
RELV,Reliv' International Inc. Common Stock,$3.73,0.03,0.811%,6514255.00,United States,,9338,Health Care,Major Pharmaceuticals
REPH,Recro Pharma Inc. Common Stock,$2.955,0.795,36.806%,69869885.00,United States,2014,6538471,Health Care,Major Pharmaceuticals
REPL,Replimune Group Inc. Common Stock,$43.11,-0.01,-0.023%,1981439668.00,United States,2018,326963,Health Care,Biotechnology: Biological Products (No Diagnostic Substances)
RESN,Resonant Inc. Common Stock,$2.15,0.03,1.415%,116478759.00,United States,2014,898048,Technology,Semiconductors
RETA,Reata Pharmaceuticals Inc. Class A Common Stock,$119.15,-4.74,-3.826%,4303191732.00,United States,2016,358462,Health Care,Major Pharmaceuticals
RETO,ReTo Eco-Solutions Inc. Common Shares,$0.64,-0.042,-6.158%,15446400.00,China,2017,460389,Capital Goods,Industrial Machinery/Components
REYN,Reynolds Consumer Products Inc. Common Stock,$29.93,-0.07,-0.233%,6276335965.00,United States,2020,845266,Consumer Durables,Containers/Packaging
RFIL,RF Industries Ltd. Common Stock,$5.70,0.21,3.825%,55697647.00,United States,,99423,Capital Goods,Electrical Products
RGCO,RGC Resources Inc. Common Stock,$24.32,-0.28,-1.138%,198711448.00,United States,,4088,Public Utilities,Oil & Gas Production
RGEN,Repligen Corporation Common Stock,$180.90,1.37,0.763%,9586300015.00,United States,1986,321591,Health Care,Biotechnology: Biological Products (No Diagnostic Substances)
RGLD,Royal Gold Inc. Common Stock,$109.26,-1.18,-1.068%,7167961218.00,United States,,192068,Basic Industries,Precious Metals
RGLS,Regulus Therapeutics Inc. Common Stock,$1.11,-0.10,-8.264%,43471037.00,United States,2012,6199963,Health Care,Major Pharmaceuticals
RGNX,REGENXBIO Inc. Common Stock,$39.96,1.11,2.857%,1494841582.00,United States,2015,338670,Health Care,Biotechnology: Biological Products (No Diagnostic Substances)
RGP,Resources Connection Inc. Common Stock,$12.90,-0.035,-0.271%,418389635.00,United States,,128779,Miscellaneous,Business Services
RIBT,RiceBran Technologies Common Stock,$0.563,0.013,2.364%,23630570.00,United States,,1346693,Consumer Non-Durables,Packaged Foods
RICK,RCI Hospitality Holdings Inc. Common Stock,$29.16,0.87,3.075%,266093194.00,United States,1995,35364,Consumer Services,Restaurants
RIDE,Lordstown Motors Corp. Class A Common Stock,$19.58,1.41,7.76%,3229699912.00,United States,2019,20771353,Capital Goods,Auto Manufacturing
RIDEW,Lordstown Motors Corp. Warrant,$8.10,1.22,17.733%,0.00,United States,2019,1070844,Capital Goods,Auto Manufacturing
RIGL,Rigel Pharmaceuticals Inc. Common Stock,$3.19,-0.07,-2.147%,539050774.00,United States,2000,1932361,Health Care,Major Pharmaceuticals
RILY,B. Riley Financial Inc. Common Stock,$36.00,-0.06,-0.166%,915536700.00,United States,,73600,Miscellaneous,Business Services
RILYG,B. Riley Financial Inc. 7.25% Senior Notes due 2027,$24.96,-0.0085,-0.034%,0.00,United States,,10918,Miscellaneous,Business Services
RILYH,B. Riley Financial Inc. 7.375% Senior Notes due 2023,$25.2601,0.0101,0.04%,0.00,United States,,12624,Miscellaneous,Business Services
RILYI,B. Riley Financial Inc. 6.875% Senior Notes due 2023,$25.00,0.0377,0.151%,0.00,United States,,4800,Miscellaneous,Business Services
RILYL,B. Riley Financial Inc. Depositary Shares each representing 1/1000th in a share of 7.375% Series B Cumulative Perpetual Preferred Stock par value $0.0001,$25.09,0.09,0.36%,0.00,United States,,1985,Miscellaneous,Business Services
RILYM,B. Riley Financial Inc. 6.375% Senior Notes due 2025,$24.76,-0.005,-0.02%,0.00,United States,,15951,Miscellaneous,Business Services
RILYN,B. Riley Financial Inc. 6.50% Senior Notes Due 2026,$24.82,0.10,0.405%,0.00,United States,,8323,Miscellaneous,Business Services
RILYO,B. Riley Financial Inc. 6.75% Senior Notes due 2024,$24.92,0.03,0.121%,0.00,United States,,762,Miscellaneous,Business Services
RILYP,B. Riley Financial Inc. Depositary Shares each representing a 1/1000th fractional interest in a share of Series A Cumulative Perpetual Preferred Stock,$24.835,0.085,0.343%,0.00,United States,,3066,Miscellaneous,Business Services
RILYZ,B. Riley Financial Inc. 7.50% Senior Notes Due 2027,$25.01,0.03,0.12%,0.00,United States,,20976,Miscellaneous,Business Services
RIOT,Riot Blockchain Inc.  Common Stock ,$8.66,-0.68,-7.281%,584808995.00,United States,,10764697,Health Care,Biotechnology: In Vitro & In Vivo Diagnostic Substances
RIVE,Riverview Financial Corporation Common Stock,$8.30,0.10,1.22%,77032425.00,United States,,1121,Finance,Major Banks
RKDA,Arcadia Biosciences Inc. Common Stock,$3.05,0.04,1.329%,33038219.00,United States,2015,50327,Consumer Non-Durables,Farming/Seeds/Milling
RLAY,Relay Therapeutics Inc. Common Stock,$50.06,-0.87,-1.708%,4504637837.00,United States,2020,130872,Health Care,Biotechnology: Biological Products (No Diagnostic Substances)
RLMD,Relmada Therapeutics Inc. Common Stock,$32.85,-2.33,-6.623%,533534129.00,United States,,107976,Health Care,Major Pharmaceuticals
RMBI,Richmond Mutual Bancorporation Inc. Common Stock,$13.28,-0.12,-0.896%,176615766.00,United States,2019,3999,Finance,Major Banks
RMBL,RumbleOn Inc. Class B Common Stock,$31.10,0.58,1.90%,69714786.00,United States,,40927,Technology,EDP Services
RMBS,Rambus Inc. Common Stock,$17.64,-0.28,-1.563%,2009593253.00,United States,1997,613154,Technology,Semiconductors
RMCF,Rocky Mountain Chocolate Factory Inc. Common Stock,$4.70,-0.07,-1.468%,28533348.00,United States,,33734,Consumer Non-Durables,Specialty Foods
RMGBU,RMG Acquisition Corp. II Unit,$10.415,0.145,1.412%,0.00,United States,2020,1308379,,
RMNI,Rimini Street Inc. (DE) Common Stock,$4.62,-0.02,-0.431%,352436700.00,United States,2015,69401,Miscellaneous,Business Services
RMR,The RMR Group Inc. Class A Common Stock,$38.24,-0.44,-1.138%,1200569312.00,United States,,62706,Consumer Services,Professional Services
RMRM,RMR Mortgage Trust Common Stock,$9.13,-0.02,-0.219%,93144342.00,United States,,90316,,
RMTI,Rockwell Medical Inc. (DE) Common Stock,$1.12,-0.07,-5.882%,104801945.00,United States,1998,1253939,Health Care,Major Pharmaceuticals
RNA,Avidity Biosciences Inc. Common Stock,$32.17,-0.33,-1.015%,1207231719.00,United States,2020,84234,Health Care,Major Pharmaceuticals
RNDB,Randolph Bancorp Inc. Common Stock,$18.65,0.12,0.648%,103013685.00,United States,2016,16951,Finance,Major Banks
RNET,RigNet Inc. Common Stock,$5.30,-0.02,-0.376%,108966839.00,United States,2010,79727,Consumer Services,Telecommunications Equipment
RNLX,Renalytix AI plc American Depositary Shares,$11.94,-0.26,-2.131%,430016915.00,United Kingdom,2020,12066,Health Care,Medical Specialities
RNST,Renasant Corporation Common Stock,$33.765,-0.235,-0.691%,1897432785.00,United States,,254717,Finance,Major Banks
RNWK,RealNetworks Inc. Common Stock,$1.55,-0.03,-1.899%,59327586.00,United States,1997,68404,Technology,EDP Services
ROAD,Construction Partners Inc. Class A Common Stock,$27.70,-1.41,-4.844%,1434354337.00,United States,2018,476621,Basic Industries,Military/Government/Technical
ROCC,Roth CH Acquisition II Co.,NA,,,,United States,,0,,
ROCCU,Roth CH Acquisition II Co.,$10.20,0.20,2.00%,,United States,,2515877,,
ROCCW,Roth CH Acquisition II Co.,NA,,,,United States,,0,,
ROCH,Roth CH Acquisition I Co. Common Stock,$13.88,-0.82,-5.578%,136412640.00,United States,2020,325848,Finance,Business Services
ROCHU,Roth CH Acquisition I Co. Unit,$17.10,0.195,1.154%,0.00,United States,2020,2595,Finance,Business Services
ROCHW,Roth CH Acquisition I Co. Warrant,$2.8299,-0.1601,-5.355%,0.00,United States,2020,112285,Finance,Business Services
ROCK,Gibraltar Industries Inc. Common Stock,$68.73,-0.12,-0.174%,2235246545.00,United States,1993,179014,Capital Goods,Steel/Iron Ore
ROIC,Retail Opportunity Investments Corp. Common Stock (MD),$13.52,-0.28,-2.029%,1595429696.00,United States,,778961,Consumer Services,Real Estate Investment Trusts
ROKU,Roku Inc. Class A Common Stock,$330.87,8.88,2.758%,41997816141.00,United States,2017,5435677,Consumer Services,Television Services
ROLL,RBC Bearings Incorporated Common Stock,$176.10,-0.90,-0.508%,4420325546.00,United States,2005,113647,Capital Goods,Metal Fabrications
ROOT,Root Inc. Class A Common Stock,$14.10,0.08,0.571%,3536259217.00,United States,2020,1527640,Finance,Property-Casualty Insurers
ROST,Ross Stores Inc. Common Stock,$112.82,-0.50,-0.441%,40164558674.00,United States,1985,1634044,Consumer Services,Clothing/Shoe/Accessory Stores
RP,RealPage Inc. Common Stock,$67.96,-0.38,-0.556%,6921830522.00,United States,2010,453901,Technology,Computer Software: Prepackaged Software
RPAY,Repay Holdings Corporation Class A Common Stock,$23.05,-0.14,-0.604%,1640428116.00,United States,2018,585457,Miscellaneous,Business Services
RPD,Rapid7 Inc. Common Stock,$72.45,-0.52,-0.713%,3755731058.00,United States,2015,621905,Technology,Computer Software: Prepackaged Software
RPRX,Royalty Pharma plc Class A Ordinary Shares ,$42.41,-2.79,-6.173%,26516445364.00,United States,2020,2139753,Health Care,Major Pharmaceuticals
RPTX,Repare Therapeutics Inc. Common Shares,$36.37,-0.67,-1.809%,1337143523.00,Canada,2020,58691,Health Care,Major Pharmaceuticals
RRBI,Red River Bancshares Inc. Common Stock,$50.70,-0.50,-0.977%,371394383.00,United States,2019,4380,Finance,Major Banks
RRGB,Red Robin Gourmet Burgers Inc. Common Stock,$19.59,-1.07,-5.179%,304464861.00,United States,2002,313076,Consumer Services,Restaurants
RRR,Red Rock Resorts Inc. Class A Common Stock,$24.08,-0.32,-1.311%,2824649160.00,United States,2016,497103,Consumer Services,Hotels/Resorts
RSSS,Research Solutions Inc Common Stock,$2.30,0.05,2.222%,60388761.00,United States,,36104,Miscellaneous,Business Services
RSVAU,Rodgers Silicon Valley Acquisition Corp. Unit,$12.20,0.64,5.536%,0.00,United States,2020,594353,Finance,Business Services
RTLR,Rattler Midstream LP Common Units,$9.63,-0.16,-1.634%,1462043828.00,United States,2019,234589,Public Utilities,Natural Gas Distribution
RUBY,Rubius Therapeutics Inc. Common Stock,$6.39,-1.30,-16.905%,517104009.00,United States,2018,475657,Health Care,Biotechnology: Biological Products (No Diagnostic Substances)
RUHN,Ruhnn Holding Limited American Depositary Shares,$2.88,-0.03,-1.031%,238914933.00,China,2019,166047,Consumer Services,Catalog/Specialty Distribution
RUN,Sunrun Inc. Common Stock,$58.28,0.70,1.216%,11512074276.00,United States,2015,4355038,Capital Goods,Industrial Specialties
RUSHA,Rush Enterprises Inc. Common Stock Cl A,$41.27,0.50,1.226%,2258995041.00,United States,,206715,Consumer Durables,Automotive Aftermarket
RUSHB,Rush Enterprises Inc. Class B,$37.99,1.07,2.898%,2079457756.00,United States,,11381,Consumer Durables,Automotive Aftermarket
RUTH,Ruth's Hospitality Group Inc. Common Stock,$16.28,-0.29,-1.75%,568167881.00,United States,2005,1224007,Consumer Services,Restaurants
RVMD,Revolution Medicines Inc. Common Stock,$41.98,-0.19,-0.451%,2786640376.00,United States,2020,732275,Health Care,Biotechnology: Biological Products (No Diagnostic Substances)
RVNC,Revance Therapeutics Inc. Common Stock,$25.415,0.585,2.356%,1691347257.00,United States,2014,480351,Health Care,Major Pharmaceuticals
RVSB,Riverview Bancorp Inc Common Stock,$5.46,-0.05,-0.907%,121955843.00,United States,,25595,Finance,Savings Institutions
RWLK,ReWalk Robotics Ltd. Ordinary Shares,$1.35,0.00,0.00%,25889221.00,Israel,2014,1323018,Health Care,Industrial Specialties
RXT,Rackspace Technology Inc. Common Stock,$20.84,0.77,3.837%,4174120187.00,United States,2020,1576048,Technology,Computer Software: Programming Data Processing
RYAAY,Ryanair Holdings plc American Depositary Shares,$106.91,-6.19,-5.473%,24089966689.00,Ireland,1997,911050,Transportation,Air Freight/Delivery Services
RYTM,Rhythm Pharmaceuticals Inc. Common Stock,$28.92,0.45,1.581%,1278401225.00,United States,2017,209691,Health Care,Major Pharmaceuticals
RZLT,Rezolute Inc. Common Stock,$19.69,-0.27,-1.353%,164456334.00,United States,,2541,Health Care,Major Pharmaceuticals
SABR,Sabre Corporation Common Stock,$10.97,-0.84,-7.113%,3480439877.00,United States,2014,11714006,Technology,Computer Software: Programming Data Processing
SABRP,Sabre Corporation 6.50% Series A Mandatory Convertible Preferred Stock,$144.49,-12.32,-7.857%,,United States,,2493,Technology,Computer Software: Programming Data Processing
SAFM,Sanderson Farms Inc. Common Stock,$143.52,-1.31,-0.905%,3191880925.00,United States,1987,185922,Consumer Non-Durables,Meat/Poultry/Fish
SAFT,Safety Insurance Group Inc. Common Stock,$77.59,0.21,0.271%,1155602028.00,United States,2002,52051,Finance,Property-Casualty Insurers
SAGE,Sage Therapeutics Inc. Common Stock,$69.04,-0.63,-0.904%,3593163534.00,United States,2014,467203,Health Care,Major Pharmaceuticals
SAIA,Saia Inc. Common Stock,$184.43,2.67,1.469%,4823991655.00,United States,,163067,Transportation,Trucking Freight/Courier Services
SAII,Software Acquisition Group Inc. II Class A Common Stock,$9.9442,0.0742,0.752%,214421813.00,United States,2020,49100,Finance,Business Services
SAIIU,Software Acquisition Group Inc. II Unit,$10.32,0.12,1.176%,0.00,United States,2020,34506,Finance,Business Services
SAIIW,Software Acquisition Group Inc. II Warrant,$0.825,0.064,8.41%,0.00,United States,2020,146126,Finance,Business Services
SAL,Salisbury Bancorp Inc. Common Stock,$38.43,0.12,0.313%,109267712.00,United States,,2602,Finance,Savings Institutions
SALM,Salem Media Group Inc. Class A Common Stock,$1.10,-0.01,-0.901%,29351699.00,United States,1999,71605,Consumer Services,Broadcasting
SAMA,Schultze Special Purpose Acquisition Corp. Common Stock,$13.74,0.14,1.029%,161328938.00,United States,2019,1345286,Finance,Business Services
SAMAU,Schultze Special Purpose Acquisition Corp. Unit,$13.9463,0.00,0.00%,0.00,United States,2018,0,Finance,Business Services
SAMAW,Schultze Special Purpose Acquisition Corp. Warrant,$2.64,0.1201,4.766%,0.00,United States,2019,851475,Finance,Business Services
SAMG,Silvercrest Asset Management Group Inc. Class A Common Stock,$14.38,-0.25,-1.709%,206674220.00,United States,2013,8274,Finance,Investment Managers
SANM,Sanmina Corporation Common Stock,$32.13,-0.14,-0.434%,2090558338.00,United States,1993,255197,Technology,Electrical Products
SANW,S&W Seed Company Common Stock (NV),$3.00,0.03,1.01%,100446027.00,United States,,46887,Consumer Non-Durables,Farming/Seeds/Milling
SASR,Sandy Spring Bancorp Inc. Common Stock,$31.62,-0.36,-1.126%,1487418144.00,United States,,103582,Finance,Major Banks
SATS,EchoStar  Corporation Common Stock,$21.44,-0.56,-2.545%,2104240806.00,United States,,1433673,Consumer Services,Telecommunications Equipment
SAVA,Cassava Sciences Inc. Common Stock,$8.12,0.42,5.455%,283823825.00,United States,,1794487,Health Care,Major Pharmaceuticals
SBAC,SBA Communications Corporation Class A Common Stock,$275.62,0.02,0.007%,30605671660.00,United States,1999,653349,Consumer Services,Real Estate Investment Trusts
SBBP,Strongbridge Biopharma plc Ordinary Shares,$2.60,-0.07,-2.622%,174833807.00,United States,2015,280631,Health Care,Major Pharmaceuticals
SBCF,Seacoast Banking Corporation of Florida Common Stock,$27.88,-0.11,-0.393%,1538101042.00,United States,,156266,Finance,Major Banks
SBFG,SB Financial Group Inc. Common Stock,$18.46,-0.14,-0.753%,139314002.00,United States,,7895,Finance,Major Banks
SBGI,Sinclair Broadcast Group Inc. Class A Common Stock,$28.62,-0.57,-1.953%,2117324200.00,United States,1995,399788,Consumer Services,Broadcasting
SBLK,Star Bulk Carriers Corp. Common Shares,$7.93,-0.29,-3.528%,761815481.00,Greece,,403783,Transportation,Marine Transportation
SBLKZ,Star Bulk Carriers Corp. 8.30% Senior Notes due 2022,$25.483,0.028,0.11%,0.00,Greece,,472,Transportation,Marine Transportation
SBNY,Signature Bank Common Stock,$128.23,-1.77,-1.362%,6869195314.00,United States,2004,661480,Finance,Major Banks
SBRA,Sabra Health Care REIT Inc. Common Stock,$17.50,0.00,0.00%,3621245688.00,United States,,1111890,Consumer Services,Real Estate Investment Trusts
SBSI,Southside Bancshares Inc. Common Stock,$31.13,-0.28,-0.891%,1029535127.00,United States,,76223,Finance,Major Banks
SBT,Sterling Bancorp Inc. Common Stock,$4.23,-0.04,-0.937%,211389432.00,United States,2017,71659,Finance,Savings Institutions
SBTX,Silverback Therapeutics Inc. Common Stock,$31.80,-0.05,-0.157%,1051521346.00,United States,2020,189931,Health Care,Major Pharmaceuticals
SBUX,Starbucks Corporation Common Stock,$103.00,-2.39,-2.268%,120891100000.00,United States,1992,6260969,Consumer Services,Restaurants
SCCI,Shimmick Construction Company Inc.,NA,,,,,,0,,
SCHL,Scholastic Corporation Common Stock,$25.905,-0.055,-0.212%,886036227.00,United States,1992,92040,Consumer Services,Books
SCHN,Schnitzer Steel Industries Inc. Class A Common Stock,$29.50,-0.04,-0.135%,799680779.00,United States,1993,248300,Consumer Durables,Industrial Specialties
SCKT,Socket Mobile Inc. Common Stock,$2.66,0.26,10.833%,16173186.00,United States,,4967954,Technology,Computer Manufacturing
SCOR,comScore Inc. Common Stock,$2.48,-0.01,-0.402%,180510632.00,United States,2018,158957,Miscellaneous,Business Services
SCPH,scPharmaceuticals Inc. Common Stock,$5.47,0.05,0.923%,149440176.00,United States,2017,149602,Health Care,Major Pharmaceuticals
SCPL,SciPlay Corporation Class A Common Stock,$14.57,0.00,0.00%,333029040.00,United States,2019,278171,Technology,EDP Services
SCPS,Scopus BioPharma Inc.,NA,,,,United States,,0,,
SCPSA,Scopus BioPharma Inc.,NA,,,,United States,,0,,
SCPSW,Scopus BioPharma Inc.,NA,,,,United States,,0,,
SCSC,ScanSource Inc. Common Stock,$26.89,-0.59,-2.147%,682054551.00,United States,,43907,Technology,Retail: Computer Software & Peripheral Equipment
SCVL,Shoe Carnival Inc. Common Stock,$36.29,-0.11,-0.302%,511818555.00,United States,1993,92228,Consumer Services,Clothing/Shoe/Accessory Stores
SCWX,SecureWorks Corp. Class A Common Stock,$12.31,0.19,1.568%,1012346592.00,United States,2016,40801,Technology,Computer Software: Prepackaged Software
SCYX,SCYNEXIS Inc. Common Stock,$7.87,0.31,4.101%,86098737.00,United States,2014,253032,Health Care,Major Pharmaceuticals
SDC,SmileDirectClub Inc. Class A Common Stock,$11.51,-0.47,-3.923%,4443540345.00,United States,2019,3414375,Health Care,Medical/Dental Instruments
SDGR,Schrodinger Inc. Common Stock,$71.81,3.88,5.712%,4989870159.00,United States,2020,1931646,Health Care,Major Pharmaceuticals
SEAC,SeaChange International Inc. Common Stock,$0.93,-0.0391,-4.035%,34927142.00,United States,1996,887857,Technology,Radio And Television Broadcasting And Communications Equipment
SECO,Secoo Holding Limited ADR,$2.65,-0.02,-0.749%,187229289.00,China,2017,69023,Consumer Services,Other Specialty Stores
SEDG,SolarEdge Technologies Inc. Common Stock,$291.51,18.03,6.593%,14928635797.00,Israel,2015,2051003,Technology,Semiconductors
SEED,Origin Agritech Limited Common Stock,$10.03,0.19,1.931%,50267592.00,China,,77011,Consumer Non-Durables,Farming/Seeds/Milling
SEEL,Seelos Therapeutics Inc. Common Stock,$1.09,-0.01,-0.909%,58231802.00,United States,,1408388,Health Care,Major Pharmaceuticals
SEER,Seer Inc. Class A Common Stock,$75.65,-5.46,-6.732%,4386558895.00,United States,2020,319026,Capital Goods,Biotechnology: Laboratory Analytical Instruments
SEIC,SEI Investments Company Common Stock,$56.32,-0.49,-0.863%,8142175923.00,United States,1981,643404,Finance,Investment Bankers/Brokers/Service
SELB,Selecta Biosciences Inc. Common Stock,$3.22,-0.15,-4.451%,347857601.00,United States,2016,1086499,Health Care,Major Pharmaceuticals
SELF,Global Self Storage Inc. Common Stock,$4.12,0.05,1.229%,38547552.00,United States,,6620,Consumer Services,Real Estate Investment Trusts
SENEA,Seneca Foods Corp. Class A Common Stock,$40.57,-0.88,-2.123%,368352921.00,United States,,26137,Consumer Non-Durables,Packaged Foods
SENEB,Seneca Foods Corp. Class B Common Stock,$42.68,0.00,0.00%,387510542.00,United States,,19,Consumer Non-Durables,Packaged Foods
SESN,Sesen Bio Inc. Common Stock,$1.67,0.01,0.602%,215997160.00,United States,2014,2432388,Health Care,Major Pharmaceuticals
SFBC,Sound Financial Bancorp Inc. Common Stock,$31.45,0.4137,1.333%,81621839.00,United States,,3893,Finance,Savings Institutions
SFBS,ServisFirst Bancshares Inc. Common Stock,$40.50,-0.32,-0.784%,2183567423.00,United States,2014,119505,Finance,Major Banks
SFET,Safe-T Group Ltd. American Depositary Share,$1.19,-0.10,-7.752%,21601582.00,Israel,2018,950678,Technology,Computer Software: Prepackaged Software
SFIX,Stitch Fix Inc. Class A Common Stock,$60.06,0.85,1.436%,6297986615.00,United States,2017,5026048,Consumer Services,Catalog/Specialty Distribution
SFM,Sprouts Farmers Market Inc. Common Stock,$19.69,-0.415,-2.064%,2322440934.00,United States,2013,2589545,Consumer Services,Food Chains
SFNC,Simmons First National Corporation Class A Common Stock,$20.94,-0.33,-1.551%,2279232958.00,United States,,358866,Finance,Major Banks
SFST,Southern First Bancshares Inc. Common Stock,$34.41,-0.08,-0.232%,266250610.00,United States,,27100,Finance,Major Banks
SFT,Shift Technologies Inc. Class A Common Stock,$8.64,-0.14,-1.595%,709404212.00,United States,2019,1134559,Consumer Durables,Automotive Aftermarket
SFTTW,Shift Technologies Inc. Warrant,$3.10,-0.03,-0.958%,0.00,United States,2019,111564,Consumer Durables,Automotive Aftermarket
SG,Sirius International Insurance Group Ltd. Common Share,$12.30,0.635,5.444%,1418181894.00,Bermuda,,30250,Finance,Property-Casualty Insurers
SGA,Saga Communications Inc. Class A Common Stock (FL),$23.90,1.93,8.785%,143228183.00,United States,,3551,Consumer Services,Broadcasting
SGAM,Seaport Global Acquisition Corp. Class A Common Stock,$9.97,0.17,1.735%,0.00,United States,2020,12680,,
SGAMU,Seaport Global Acquisition Corp. Unit,$10.2299,-0.0201,-0.196%,0.00,United States,2020,65292,Finance,Business Services
SGAMW,Seaport Global Acquisition Corp. Warrant,$0.845,-0.055,-6.111%,0.00,United States,2020,36253,,
SGBX,SG Blocks Inc. Common Stock,$3.30,0.01,0.304%,28367424.00,United States,2017,478464,Consumer Services,RETAIL: Building Materials
SGC,Superior Group of Companies Inc. Common Stock,$21.78,-0.41,-1.848%,336175324.00,United States,,26039,Consumer Non-Durables,Apparel
SGEN,Seagen Inc. Common Stock,$191.175,4.625,2.479%,34219678829.00,United States,2001,782645,Health Care,Biotechnology: Biological Products (No Diagnostic Substances)
SGH,SMART Global Holdings Inc. Ordinary Shares,$34.29,-1.12,-3.163%,837354325.00,United States,2017,277758,Technology,Semiconductors
SGLB,Sigma Labs Inc. Common Stock,$2.76,-0.07,-2.473%,16090800.00,United States,,125431,Consumer Durables,Miscellaneous manufacturing industries
SGLBW,Sigma Labs Inc. Warrant,$0.1562,0.003,1.958%,0.00,United States,,13999,Consumer Durables,Miscellaneous manufacturing industries
SGMA,SigmaTron International Inc. Common Stock,$4.34,-0.01,-0.23%,18412485.00,United States,1994,87272,Technology,Electrical Products
SGMO,Sangamo Therapeutics Inc. Common Stock,$12.28,-3.37,-21.534%,1736900122.00,United States,2000,11830285,Health Care,Biotechnology: Biological Products (No Diagnostic Substances)
SGMS,Scientific Games Corp Common Stock,$40.23,-1.42,-3.409%,3828680129.00,United States,,4354199,Technology,EDP Services
