Symbol,Name,Last Sale,Net Change,% Change,Market Cap,Country,IPO Year,Volume,Sector,Industry
JBSS,John B. Sanfilippo & Son Inc. Common Stock,$76.96,0.84,1.104%,878855264.00,United States,1991,31261,Consumer Non-Durables,Specialty Foods
JCIC,Jack Creek Investment Corp.,NA,,,,United States,,0,,
JCICU,Jack Creek Investment Corp. Units,NA,,,,United States,,0,Finance,Business Services
JCICW,Jack Creek Investment Corp.,NA,,,,United States,,0,,
JCOM,j2 Global Inc. Common Stock,$100.50,1.915,1.942%,4498237592.00,United States,1999,638202,Technology,Telecommunications Equipment
JCS,Communications Systems Inc. Common Stock,$4.575,0.065,1.441%,42641173.00,United States,,22884,Public Utilities,Telecommunications Equipment
JCTCF,Jewett-Cameron Trading Company Common Shares,$9.05,0.00,0.00%,31504516.00,United States,,4517,Consumer Services,RETAIL: Building Materials
JD,JD.com Inc. American Depositary Shares,$82.61,0.90,1.101%,128035338970.00,China,2014,13918516,Consumer Services,Other Specialty Stores
JFIN,Jiayin Group Inc. American Depositary Shares,$3.73,0.01,0.269%,201513250.00,China,2019,138387,Finance,Finance: Consumer Services
JFU,9F Inc. American Depositary Shares,$1.38,-0.06,-4.167%,269363580.00,China,2019,625576,Finance,Finance: Consumer Services
JG,Aurora Mobile Limited American Depositary Shares,$3.42,0.15,4.587%,395772752.00,China,2018,204758,Technology,Computer Software: Programming Data Processing
JJSF,J & J Snack Foods Corp. Common Stock,$152.54,0.18,0.118%,2891194347.00,United States,1986,52949,Consumer Non-Durables,Specialty Foods
JKHY,Jack Henry & Associates Inc. Common Stock,$155.82,1.98,1.287%,11891585609.00,United States,1985,672544,Technology,EDP Services
JMPNL,JMP Group LLC 7.25% Senior Notes due 2027,$24.75,0.38,1.559%,0.00,United States,,1873,Finance,Investment Bankers/Brokers/Service
JMPNZ,JMP Group LLC 6.875% Senior Notes due 2029,$24.00,0.30,1.266%,0.00,United States,,15110,Finance,Investment Bankers/Brokers/Service
JNCE,Jounce Therapeutics Inc. Common Stock,$6.65,-0.09,-1.335%,265012309.00,United States,2017,336027,Health Care,Biotechnology: Biological Products (No Diagnostic Substances)
JOBS,51job Inc. American Depositary Shares,$71.24,-2.01,-2.744%,4801614256.00,China,2004,251401,Technology,Diversified Commercial Services
JOUT,Johnson Outdoors Inc. Class A Common Stock,$95.77,5.22,5.765%,965821200.00,United States,,113311,Consumer Non-Durables,Recreational Products/Toys
JRJC,China Finance Online Co. Limited American Depositary Shares,$9.24,-0.06,-0.645%,22563710.00,China,2004,16027,Finance,Investment Bankers/Brokers/Service
JRSH,Jerash Holdings (US) Inc. Common Stock,$5.30,-0.05,-0.935%,60022500.00,United States,2018,5828,Consumer Non-Durables,Apparel
JRVR,James River Group Holdings Ltd. Common Shares,$46.76,0.23,0.494%,1431330754.00,Bermuda,2014,138282,Finance,Property-Casualty Insurers
JSM,Navient Corporation 6% Senior Notes due December 15 2043,$23.36,-0.085,-0.363%,0.00,United States,,52227,Finance,Finance: Consumer Services
JUPW,Jupiter Wellness Inc. Common Stock,$4.01,0.06,1.519%,36821155.00,United States,2020,14237,Consumer Non-Durables,Package Goods/Cosmetics
JUPWW,Jupiter Wellness Inc. Warrant,$0.4601,0.00,0.00%,0.00,United States,2020,0,Consumer Non-Durables,Package Goods/Cosmetics
JVA,Coffee Holding Co. Inc. Common Stock,$3.78,0.02,0.532%,21578504.00,United States,2005,16145,Consumer Non-Durables,Food Distributors
JYAC,Jiya Acquisition Corp. Class A Common Stock,$10.19,0.03,0.295%,136291250.00,United States,2020,8719,Finance,Business Services
JYNT,The Joint Corp. Common Stock,$26.38,-0.29,-1.087%,370405431.00,United States,2014,86085,Miscellaneous,Multi-Sector Companies
KALA,Kala Pharmaceuticals Inc. Common Stock,$7.48,-0.18,-2.35%,419327790.00,United States,2017,1575667,Health Care,Major Pharmaceuticals
KALU,Kaiser Aluminum Corporation Common Stock,$94.55,-1.23,-1.284%,1495040579.00,United States,,80336,Capital Goods,Metal Fabrications
KALV,KalVista Pharmaceuticals Inc. Common Stock,$18.83,1.30,7.416%,337199336.00,United Kingdom,2015,188475,Health Care,Major Pharmaceuticals
KBAL,Kimball International Inc. Class B Common Stock,$11.80,-0.18,-1.503%,436333922.00,United States,,259152,Consumer Durables,Home Furnishings
KBNT,Kubient Inc. Common Stock,$7.27,0.16,2.25%,55697651.00,United States,2020,428566,Technology,EDP Services
KBNTW,Kubient Inc. Warrant,$2.55,0.5499,27.494%,0.00,United States,2020,46395,Technology,EDP Services
KBSF,KBS Fashion Group Limited Common Stock,$2.74,-0.10,-3.521%,7100159.00,China,2013,34218,Consumer Non-Durables,Apparel
KC,Kingsoft Cloud Holdings Limited American Depositary Shares,$47.10,1.96,4.342%,10268636779.00,China,2020,2661860,Technology,Computer Software: Prepackaged Software
KCAPL,KCAP Financial Inc. 6.125% Notes due 2022,$25.2391,-0.1609,-0.633%,0.00,United States,,771,,
KDMN,Kadmon Holdings Inc. Common Stock,$4.21,-0.26,-5.817%,722069498.00,United States,,2265120,Health Care,Major Pharmaceuticals
KDNY,Chinook Therapeutics Inc. Common Stock,$13.32,-0.33,-2.418%,561550314.00,United States,2015,120207,Health Care,Major Pharmaceuticals
KDP,Keurig Dr Pepper Inc. Common Stock,$30.36,0.18,0.596%,42724210006.00,United States,,3162781,Consumer Non-Durables,Beverages (Production/Distribution)
KE,Kimball Electronics Inc. Common Stock,$15.63,-0.12,-0.762%,392989607.00,United States,,41876,Technology,Electrical Products
KELYA,Kelly Services Inc. Class A Common Stock,$22.17,0.07,0.317%,871209169.00,United States,,87567,Technology,Professional Services
KELYB,Kelly Services Inc. Class B Common Stock,$22.06,0.00,0.00%,866886526.00,United States,,307,Technology,Professional Services
KEQU,Kewaunee Scientific Corporation Common Stock,$9.35,-0.28,-2.908%,25792069.00,United States,,1539,Capital Goods,Medical Specialities
KERN,Akerna Corp. Common Stock,$3.50,-0.28,-7.407%,49205475.00,United States,2018,819053,Technology,EDP Services
KERNW,Akerna Corp Warrant,$0.45,0.02,4.651%,0.00,United States,2018,22276,Technology,EDP Services
KFFB,Kentucky First Federal Bancorp Common Stock,$6.90,0.00,0.00%,56885084.00,United States,,130,Finance,Savings Institutions
KFRC,Kforce Inc. Common Stock,$43.48,-0.11,-0.252%,954650271.00,United States,1995,65186,Technology,Professional Services
KHC,The Kraft Heinz Company Common Stock,$34.07,-0.03,-0.088%,41654771334.00,United States,,3813065,Consumer Non-Durables,Packaged Foods
KIDS,OrthoPediatrics Corp. Common Stock,$43.86,-2.43,-5.25%,857665677.00,United States,2017,434837,Health Care,Medical/Dental Instruments
KIN,Kindred Biosciences Inc. Common Stock,$3.92,0.03,0.771%,154639347.00,United States,2013,303908,Health Care,Major Pharmaceuticals
KINS,Kingstone Companies Inc. Common Stock,$6.18,0.34,5.822%,65972724.00,United States,,35135,Finance,Property-Casualty Insurers
KINZ,KINS Technology Group Inc.,NA,,,,United States,,0,,
KINZU,KINS Technology Group Inc. Unit,NA,,,,United States,,0,Finance,Business Services
KINZW,KINS Technology Group Inc.,NA,,,,United States,,0,,
KIRK,Kirkland's Inc. COMMONSTOCK,$17.64,0.25,1.438%,251468713.00,United States,2002,654822,Consumer Services,Other Specialty Stores
KLAC,KLA Corporation Common Stock,$257.63,1.65,0.645%,39793482654.00,United States,1980,1124289,Capital Goods,Electronic Components
KLDO,Kaleido Biosciences Inc. Common Stock,$9.40,1.18,14.355%,338231787.00,United States,2019,196873,Health Care,Biotechnology: Biological Products (No Diagnostic Substances)
KLIC,Kulicke and Soffa Industries Inc. Common Stock,$33.67,-0.35,-1.029%,2088527676.00,Singapore,,1432775,Technology,Semiconductors
KLXE,KLX Energy Services Holdings Inc. Common Stock,$7.64,-0.31,-3.899%,64187460.00,United States,,102682,Energy,Oilfield Services/Equipment
KMDA,Kamada Ltd. Ordinary Shares,$6.30,-0.15,-2.326%,281804380.00,Israel,2013,80457,Health Care,Major Pharmaceuticals
KNDI,Kandi Technologies Group Inc Common Stock,$8.47,0.09,1.074%,613037891.00,China,,6562645,Capital Goods,Auto Manufacturing
KNSA,Kiniksa Pharmaceuticals Ltd. Class A Common Stock,$18.13,0.04,0.221%,1234200385.00,United States,2018,236254,Health Care,Major Pharmaceuticals
KNSL,Kinsale Capital Group Inc. Common Stock,$236.58,-1.63,-0.684%,5364944296.00,United States,2016,77023,Finance,Property-Casualty Insurers
KNTE,Kinnate Biopharma Inc. Common Stock,$41.01,-3.79,-8.46%,1703031251.00,United States,2020,286406,Health Care,Major Pharmaceuticals
KOD,Kodiak Sciences Inc Common Stock,$125.82,-0.92,-0.726%,6388594674.00,United States,2018,305809,Health Care,Biotechnology: Biological Products (No Diagnostic Substances)
KOPN,Kopin Corporation Common Stock,$1.77,0.04,2.312%,150543881.00,United States,1992,337448,Technology,Semiconductors
KOR,Corvus Gold Inc. Common Shares,$2.35,-0.03,-1.261%,291371436.00,Canada,,203793,Basic Industries,Precious Metals
KOSS,Koss Corporation Common Stock,$2.3756,0.00,0.00%,17590917.00,United States,,580,Consumer Non-Durables,Consumer Electronics/Appliances
KPTI,Karyopharm Therapeutics Inc. Common Stock,$15.36,0.07,0.458%,1130507935.00,United States,2013,1860016,Health Care,Major Pharmaceuticals
KRBP,Kiromic BioPharma Inc. Common Stock,$9.505,-0.425,-4.28%,69700155.00,United States,2020,50109,Health Care,Biotechnology: Biological Products (No Diagnostic Substances)
KRKR,36Kr Holdings Inc. American Depositary Shares,$3.06,-0.15,-4.673%,114732680.00,China,2019,66816,Miscellaneous,Business Services
KRMD,Repro Med Systems Inc. Common Stock,$5.86,0.14,2.448%,257505324.00,United States,,630354,Health Care,Medical/Dental Instruments
KRNT,Kornit Digital Ltd. Ordinary Shares,$84.50,-0.51,-0.60%,3825984916.00,Israel,2015,268353,Capital Goods,Industrial Machinery/Components
KRNY,Kearny Financial Corp Common Stock,$10.43,-0.22,-2.066%,933594004.00,United States,,654552,Finance,Savings Institutions
KRON,Kronos Bio Inc. Common Stock,$32.36,1.58,5.133%,1813244189.00,United States,2020,152486,Health Care,Major Pharmaceuticals
KROS,Keros Therapeutics Inc. Common Stock,$76.83,-0.17,-0.221%,1780792707.00,United States,2020,118395,Health Care,Major Pharmaceuticals
KRTX,Karuna Therapeutics Inc. Common Stock,$94.55,-2.93,-3.006%,2534560815.00,United States,2019,87357,Health Care,Major Pharmaceuticals
KRUS,Kura Sushi USA Inc. Class A Common Stock,$17.33,-0.40,-2.256%,144572440.00,United States,2019,60567,Consumer Services,Restaurants
KRYS,Krystal Biotech Inc. Common Stock,$58.38,1.65,2.909%,1150530856.00,United States,2017,241644,Health Care,Biotechnology: Biological Products (No Diagnostic Substances)
KSMT,Kismet Acquisition One Corp Ordinary Shares,$9.90,0.09,0.917%,314325000.00,Russia,2020,84624,Finance,Business Services
KSMTU,Kismet Acquisition One Corp Unit,$10.25,0.09,0.886%,0.00,Russia,2020,300000,Finance,Business Services
KSMTW,Kismet Acquisition One Corp Warrant,$0.9999,-0.1251,-11.12%,0.00,Russia,,18094,Finance,Business Services
KSPN,Kaspien Holdings Inc. Common Stock,$14.42,1.21,9.16%,26319355.00,United States,,5901,Consumer Services,Consumer Electronics/Video Chains
KTCC,Key Tronic Corporation Common Stock,$7.98,0.01,0.125%,85862246.00,United States,1983,6521,Technology,Electrical Products
KTOS,Kratos Defense & Security Solutions Inc. Common Stock,$23.85,0.27,1.145%,2927733653.00,United States,,543145,Capital Goods,Military/Government/Technical
KTOV,Kitov Pharma Ltd. American Depositary Shares,$4.17,-0.02,-0.477%,71768094.00,Israel,2015,411919,Health Care,Major Pharmaceuticals
KTRA,Kintara Therapeutics Inc. Common Stock,$1.42,-0.13,-8.387%,35020465.00,United States,,644211,Health Care,Major Pharmaceuticals
KURA,Kura Oncology Inc. Common Stock,$41.62,0.95,2.336%,2360190664.00,United States,,2099676,Health Care,Major Pharmaceuticals
KVHI,KVH Industries Inc. Common Stock,$10.58,-0.10,-0.936%,193642132.00,United States,1996,30273,Technology,Radio And Television Broadcasting And Communications Equipment
KXIN,Kaixin Auto Holdings Ordinary Share,$4.03,0.10,2.545%,260652940.00,China,2017,2015893,Consumer Durables,Automotive Aftermarket
KYMR,Kymera Therapeutics Inc. Common Stock,$61.97,1.14,1.874%,2755120574.00,United States,2020,179201,Health Care,Biotechnology: Biological Products (No Diagnostic Substances)
KZIA,Kazia Therapeutics Limited American Depositary Shares,$9.93,-0.73,-6.848%,93960996.00,Australia,,148419,Health Care,Major Pharmaceuticals
KZR,Kezar Life Sciences Inc. Common Stock,$5.56,-0.01,-0.18%,257251609.00,United States,2018,148911,Health Care,Major Pharmaceuticals
LACQ,Leisure Acquisition Corp. Common Stock,$12.80,1.45,12.775%,80157222.00,United States,2017,3853,Finance,Business Services
LACQU,Leisure Acquisition Corp. Unit,$14.99,2.39,18.968%,0.00,United States,2017,8440,Finance,Business Services
LACQW,Leisure Acquisition Corp. Warrant,$0.86,0.089,11.543%,0.00,United States,2017,67214,Finance,Business Services
LAKE,Lakeland Industries Inc. Common Stock,$22.28,-0.27,-1.197%,177792217.00,United States,1986,1199824,Health Care,Industrial Specialties
LAMR,Lamar Advertising Company Class A Common Stock,$78.70,-0.62,-0.782%,7936741692.00,United States,1996,389731,Consumer Services,Real Estate Investment Trusts
LANC,Lancaster Colony Corporation Common Stock,$172.61,0.79,0.46%,4753506790.00,United States,,71740,Consumer Non-Durables,Packaged Foods
LAND,Gladstone Land Corporation Common Stock,$14.79,0.07,0.476%,356474585.00,United States,1993,214574,Consumer Services,Real Estate Investment Trusts
LANDO,Gladstone Land Corporation 6.00% Series B Cumulative Redeemable Preferred Stock,$24.59,0.18,0.737%,0.00,United States,,106937,Consumer Services,Real Estate Investment Trusts
LANDP,Gladstone Land Corporation 6.375% Series A Cumulative Term Preferred Stock,$26.46,0.37,1.418%,0.00,United States,,2906,Consumer Services,Real Estate Investment Trusts
LARK,Landmark Bancorp Inc. Common Stock,$23.68,-0.72,-2.951%,112161196.00,United States,,4329,Finance,Major Banks
LASR,nLIGHT Inc. Common Stock,$33.35,-0.79,-2.314%,1312855800.00,United States,2018,280967,Technology,Semiconductors
LATN,Union Acquisition Corp. II Ordinary Shares,$10.07,0.02,0.199%,251750000.00,United States,2019,6078,Finance,Business Services
LATNU,Union Acquisition Corp. II Units containing one ordinary share and one redeemable warrant,$10.8429,0.00,0.00%,0.00,United States,2019,0,Finance,Business Services
LATNW,Union Acquisition Corp. II Warrant,$0.80,-0.03,-3.614%,0.00,United States,2019,27766,Finance,Business Services
LAUR,Laureate Education Inc. Class A Common Stock,$15.20,0.23,1.536%,3193102350.00,United States,2017,399112,Consumer Services,Other Consumer Services
LAWS,Lawson Products Inc. Common Stock,$50.10,-0.90,-1.765%,452419383.00,United States,,18377,Consumer Durables,Industrial Specialties
LAZR,Luminar Technologies Inc.  Class A Common Stock,$28.12,-6.05,-17.706%,0.00,United States,2019,22127282,Capital Goods,Auto Parts:O.E.M.
LAZRW,Luminar Technologies Inc. Warrant,$10.10,-2.33,-18.745%,0.00,United States,2019,1058792,Capital Goods,Auto Parts:O.E.M.
LAZY,Lazydays Holdings Inc. Common Stock,$14.86,0.61,4.281%,140454506.00,United States,,108464,Consumer Durables,Automotive Aftermarket
LBAI,Lakeland Bancorp Inc. Common Stock,$12.54,-0.16,-1.26%,632879191.00,United States,,126585,Finance,Major Banks
LBC,Luther Burbank Corporation Common Stock,$10.25,-0.09,-0.87%,537202090.00,United States,2003,10670,Finance,Major Banks
LBRDA,Liberty Broadband Corporation Class A Common Stock,$158.75,-0.15,-0.094%,28336116651.00,United States,,44173,Consumer Services,Television Services
LBRDK,Liberty Broadband Corporation Class C Common Stock,$161.69,0.29,0.18%,28860892607.00,United States,,690697,Consumer Services,Television Services
LBTYA,Liberty Global plc Class A Ordinary Shares,$23.92,-0.23,-0.952%,13947899275.00,United Kingdom,,1131032,,
LBTYB,Liberty Global plc Class B Ordinary Shares,$24.12,0.00,0.00%,14064520507.00,United Kingdom,,132,Consumer Services,Television Services
LBTYK,Liberty Global plc Class C Ordinary Shares,$23.02,-0.18,-0.776%,13423103734.00,United Kingdom,,2496382,,
LCA,Landcadia Holdings II Inc. Class A Common Stock,$22.16,-1.09,-4.688%,876012500.00,United States,2019,1945757,Technology,Computer Software: Prepackaged Software
LCAHU,Landcadia Holdings II Inc. Unit,$24.80,-1.07,-4.136%,0.00,United States,2019,2336,Technology,Computer Software: Prepackaged Software
LCAHW,Landcadia Holdings II Inc. Warrant,$9.10,0.21,2.362%,0.00,United States,2019,639029,Technology,Computer Software: Prepackaged Software
LCAP,Lionheart Acquisition Corp. II Class A Common Stock,$10.10,0.22,2.227%,296940000.00,United States,2020,119537,Finance,Business Services
LCAPU,Lionheart Acquisition Corp. II Unit,$10.40,0.03,0.289%,0.00,United States,2020,275788,Finance,Business Services
LCAPW,Lionheart Acquisition Corp. II Warrant,$1.10,0.05,4.762%,0.00,United States,2020,52902,Finance,Business Services
LCNB,LCNB Corporation Common Stock,$14.94,-0.23,-1.516%,192407330.00,United States,,12782,Finance,Major Banks
LCUT,Lifetime Brands Inc. Common Stock,$14.44,-0.13,-0.892%,314330209.00,United States,1991,39497,Capital Goods,Industrial Machinery/Components
LCY,Landcadia Holdings III Inc. Class A Common Stock,$10.02,0.07,0.704%,645037500.00,United States,2020,238839,Technology,Computer Software: Prepackaged Software
LCYAU,Landcadia Holdings III Inc. Unit ,$10.42,-0.08,-0.762%,0.00,United States,2020,107979,Finance,Business Services
LCYAW,Landcadia Holdings III Inc. Warrant,$1.59,0.05,3.247%,0.00,United States,2020,131778,Finance,Business Services
LE,Lands' End Inc. Common Stock,$18.20,-0.22,-1.194%,593461177.00,United States,,218332,Consumer Services,Clothing/Shoe/Accessory Stores
LECO,Lincoln Electric Holdings Inc. Common Shares,$120.71,1.21,1.013%,7178709646.00,United States,,294305,Technology,Industrial Machinery/Components
LEDS,SemiLEDS Corporation Common Stock,$3.07,-0.01,-0.325%,12314762.00,Taiwan,2010,13741,Technology,Semiconductors
LEGH,Legacy Housing Corporation Common Stock (TX),$14.95,0.10,0.673%,361672747.00,United States,2018,5864,Basic Industries,Homebuilding
LEGN,Legend Biotech Corporation American Depositary Shares,$28.08,-0.16,-0.567%,3629130888.00,United States,2020,217680,Health Care,Major Pharmaceuticals
LEGO,Legato Merger Corp.,NA,,,,United States,,0,,
LEGOU,Legato Merger Corp. Units,NA,,,,United States,,0,Finance,Business Services
LEGOW,Legato Merger Corp.,NA,,,,United States,,0,,
LESL,Leslie's Inc. Common Stock,$20.31,-0.02,-0.098%,3789972491.00,United States,2020,541603,Consumer Services,Other Specialty Stores
LEVL,Level One Bancorp Inc. Common Stock,$21.02,-0.88,-4.018%,162575448.00,United States,2018,8654,Finance,Major Banks
LEVLP,Level One Bancorp Inc. Depositary Shares Each Representing a 1/100th Interest in a Share of 7.50% Non-Cumulative Perpetual Preferred Stock Series B,$26.75,0.00,0.00%,0.00,United States,,0,Finance,Major Banks
LFAC,LF Capital Acquistion Corp. Class A Common Stock,$10.66,0.01,0.094%,171632535.00,United States,2018,371220,Capital Goods,Homebuilding
LFACU,LF Capital Acquistion Corp. Unit,$11.5483,0.00,0.00%,0.00,United States,2018,0,Capital Goods,Homebuilding
LFACW,LF Capital Acquistion Corp. Warrant,$1.93,-0.0099,-0.51%,0.00,United States,2018,14781,Capital Goods,Homebuilding
LFTRU,Lefteris Acquisition Corp. Unit,$10.12,0.00,0.00%,0.00,United States,2020,117478,Finance,Business Services
LFUS,Littelfuse Inc. Common Stock,$246.73,1.96,0.801%,6014055840.00,United States,,99952,Consumer Durables,Electrical Products
LFVN,Lifevantage Corporation Common Stock (Delaware),$10.42,0.07,0.676%,148629254.00,United States,,65936,Health Care,Major Pharmaceuticals
LGHL,Lion Group Holding Ltd. American Depositary Share,$2.13,-0.07,-3.182%,38515746.00,China,,52058,Finance,Investment Bankers/Brokers/Service
LGHLW,Lion Group Holding Ltd. Warrant,$0.0875,0.0004,0.459%,0.00,China,,2181,Finance,Investment Bankers/Brokers/Service
LGIH,LGI Homes Inc. Common Stock,$107.82,1.58,1.487%,2706327931.00,United States,2013,242132,Capital Goods,Homebuilding
LGND,Ligand Pharmaceuticals Incorporated Common Stock,$92.84,0.72,0.782%,1492989656.00,United States,,292549,Health Care,Major Pharmaceuticals
LHCG,LHC Group Common Stock,$200.50,0.41,0.205%,6334247930.00,United States,2005,207399,Health Care,Medical/Nursing Services
LI,Li Auto Inc. American Depositary Shares,$31.36,-1.13,-3.478%,26674632701.00,China,2020,13573048,Capital Goods,Auto Manufacturing
LIFE,aTyr Pharma Inc. Common Stock,$4.64,0.34,7.907%,47260525.00,United States,2015,27849107,Health Care,Biotechnology: Biological Products (No Diagnostic Substances)
LILA,Liberty Latin America Ltd. Class A Common Stock,$11.38,-0.29,-2.485%,2640232980.00,United States,,265429,Consumer Services,Television Services
LILAK,Liberty Latin America Ltd. Class C Common Stock,$11.43,-0.26,-2.224%,2651833301.00,United States,,979265,Consumer Services,Television Services
LINC,Lincoln Educational Services Corporation Common Stock,$6.26,0.08,1.294%,165741820.00,United States,2005,113119,Consumer Services,Other Consumer Services
LIND,Lindblad Expeditions Holdings Inc. Common Stock,$14.28,-0.22,-1.517%,712217656.00,United States,2013,429736,Consumer Services,Transportation Services
LIQT,LiqTech International Inc. Common Stock,$8.53,-0.01,-0.117%,184721082.00,Denmark,,24883,Technology,Industrial Machinery/Components
LITE,Lumentum Holdings Inc. Common Stock,$86.62,-1.72,-1.947%,6539810000.00,United States,,873820,Capital Goods,Telecommunications Equipment
LIVE,Live Ventures Incorporated Common Stock,$11.66,-0.13,-1.103%,18691341.00,United States,,5895,Finance,Finance/Investors Services
LIVK,LIV Capital Acquisition Corp. Class A Ordinary Shares,$10.03,0.13,1.313%,101628975.00,Mexico,2020,1000,Finance,Business Services
LIVKU,LIV Capital Acquisition Corp. Unit,$10.50,0.00,0.00%,0.00,Mexico,2019,0,Finance,Business Services
LIVKW,LIV Capital Acquisition Corp. Warrant,$0.6701,-0.03,-4.285%,0.00,Mexico,2020,1100,Finance,Business Services
LIVN,LivaNova PLC Ordinary Shares,$60.72,-1.44,-2.317%,2950774440.00,United Kingdom,,607342,Health Care,Biotechnology: Electromedical & Electrotherapeutic Apparatus
LIVX,LiveXLive Media Inc. Common Stock,$2.84,0.24,9.231%,204778302.00,United States,,2563553,Consumer Services,Restaurants
LIXT,Lixte Biotechnology Holdings Inc. Common Stock,$3.34,-0.25,-6.964%,41330169.00,United States,,41539,Health Care,Major Pharmaceuticals
LIXTW,Lixte Biotechnology Holdings Inc. Warrants,$0.79,-0.011,-1.373%,0.00,United States,,268,Health Care,Major Pharmaceuticals
LIZI,LIZHI INC. American Depositary Shares,$3.50,0.03,0.865%,161472101.00,China,2020,889422,Technology,Computer Software: Programming Data Processing
LJPC,La Jolla Pharmaceutical Company Common Stock,$4.64,0.11,2.428%,127048745.00,United States,1994,187008,Health Care,Biotechnology: Biological Products (No Diagnostic Substances)
LKCO,Luokung Technology Corp Ordinary Shares,$0.53,0.00,0.00%,106698306.00,China,,414714,Technology,EDP Services
LKFN,Lakeland Financial Corporation Common Stock,$52.14,-0.44,-0.837%,1340697093.00,United States,,61224,Finance,Major Banks
LKQ,LKQ Corporation Common Stock,$36.66,0.09,0.246%,11157297965.00,United States,,1446505,Consumer Services,Motor Vehicles
LLIT,Lianluo Smart Limited Class A Common Stock,$4.98,0.06,1.22%,2240731.00,China,,198238,Consumer Services,Other Specialty Stores
LLNW,Limelight Networks Inc. Common Stock,$4.12,-0.015,-0.363%,506651669.00,United States,2007,3747507,Miscellaneous,Business Services
LMAT,LeMaitre Vascular Inc. Common Stock,$34.66,-1.05,-2.94%,705053200.00,United States,2006,147134,Health Care,Medical/Dental Instruments
LMB,Limbach Holdings Inc. Common Stock,$12.61,-0.14,-1.098%,99948588.00,United States,,55445,Basic Industries,Engineering & Construction
LMFA,LM Funding America Inc. Common Stock,$0.651,0.0116,1.814%,10025400.00,United States,2015,372897,Finance,Finance: Consumer Services
LMNL,Liminal BioSciences Inc. Common Shares,$4.16,-0.18,-4.147%,122245531.00,Canada,,283218,Health Care,Major Pharmaceuticals
LMNR,Limoneira Co Common Stock,$15.45,0.36,2.386%,275251128.00,United States,,59053,Consumer Non-Durables,Farming/Seeds/Milling
LMNX,Luminex Corporation Common Stock,$24.40,0.03,0.123%,1135222029.00,United States,2000,562820,Health Care,Medical/Dental Instruments
LMPX,LMP Automotive Holdings Inc. Common Stock,$24.73,-2.66,-9.712%,244912393.00,United States,2019,290530,Consumer Durables,Automotive Aftermarket
LMRK,Landmark Infrastructure Partners LP Common Units,$11.25,0.36,3.306%,286627973.00,United States,2014,97136,Consumer Services,Real Estate
LMRKN,Landmark Infrastructure Partners LP 7% Series C Fltg/Fxd Perpetual Conv Preferred Stock,$25.10,0.00,0.00%,0.00,United States,,1039,Consumer Services,Real Estate
LMRKO,Landmark Infrastructure Partners LP Perpetual Preferred Units Series B 7.90%,$25.17,0.11,0.439%,0.00,United States,,4570,Consumer Services,Real Estate
LMRKP,Landmark Infrastructure Partners LP 8.00% Series A Cumulative Redeemable Perpetual Preferred Units,$25.455,0.153,0.605%,0.00,United States,,2106,Consumer Services,Real Estate
LMST,Limestone Bancorp Inc. Common Stock,$14.74,0.23,1.585%,110552314.00,United States,,1328,Finance,Major Banks
LNDC,Landec Corporation Common Stock (DE),$11.77,0.01,0.085%,344177034.00,United States,1996,218119,Consumer Non-Durables,Packaged Foods
LNSR,LENSAR Inc. Common Stock,$8.53,0.00,0.00%,90749126.00,United States,,28207,Health Care,Medical/Dental Instruments
LNT,Alliant Energy Corporation Common Stock,$51.705,-0.155,-0.299%,12913875080.00,United States,,810208,Public Utilities,Power Generation
LNTH,Lantheus Holdings Inc. Common Stock,$14.62,-0.17,-1.149%,977659210.00,United States,2015,219581,Health Care,Biotechnology: In Vitro & In Vivo Diagnostic Substances
LOAC,Longevity Acquisition Corporation Ordinary Shares,$11.00,0.18,1.664%,28895042.00,China,2018,12564,Finance,Business Services
LOACR,Longevity Acquisition Corporation Right,$0.76,0.0097,1.293%,0.00,China,2018,57333,Finance,Business Services
LOACU,Longevity Acquisition Corporation Units,$12.05,0.00,0.00%,0.00,China,2018,1,Finance,Business Services
